{
  "hierarchy": "l1",
  "description": "aa",
  "holidays": [
    { "holidayType": "FIXED_DATE", "key": "l1", "month": "JANUARY", "day": 1 }
  ],
  "subConfigurations": [
    {
      "hierarchy": "l1.1",
      "description": "l1.1",
      "holidays": [
        { "holidayType": "FIXED_DATE", "key": "l1.1", "month": "JANUARY", "day": 1 }
      ]
    },
    {
      "hierarchy": "l1.2",
      "description": "l1.2",
      "holidays": [
        { "holidayType": "FIXED_DATE", "key": "l1.2", "month": "JANUARY", "day": 1 }
      ],
      "subConfigurations": [
        {
          "hierarchy": "l1.2.1",
          "description": "l1.2.1",
          "holidays": [
            { "holidayType": "FIXED_DATE", "key": "l1.2.1", "month": "JANUARY", "day": 1 }
          ]
        },
        {
          "hierarchy": "l1.2.2",
          "description": "l1.2.2",
          "holidays": [
            { "holidayType": "FIXED_DATE", "key": "l1.2.2", "month": "JANUARY", "day": 1 }
          ]
        }
      ]
    },
    {
      "hierarchy": "l1.3",
      "description": "l1.3",
      "holidays": [
        { "holidayType": "FIXED_DATE", "key": "l1.3", "month": "JANUARY", "day": 1 }
      ],
      "subConfigurations": [
        {
          "hierarchy": "l1.3.1",
          "description": "l1.3.1",
          "holidays": [
            { "holidayType": "FIXED_DATE", "key": "l1.3.1", "month": "JANUARY", "day": 1 }
          ]
        },
        {
          "hierarchy": "l1.3.2",
          "description": "l1.3.2",
          "holidays": [
            { "holidayType": "FIXED_DATE", "key": "l1.3.2", "month": "JANUARY", "day": 1 }
          ],
          "subConfigurations": [
            {
              "hierarchy": "l1.3",
              "description": "l1.3 bis",
              "holidays": [
                { "holidayType": "FIXED_DATE", "key": "l1.3 bis", "month": "JANUARY", "day": 1 }
              ]
            }
          ]
        }
      ]
    }
  ]
}
